{
  "$schema": "https://json-schema.org/draft/2020-12/schema",
  "title": "caldav-calendar event recurrence override input",
  "type": "object",
  "required": ["start", "end"],
  "properties": {
    "title": { "type": "string", "minLength": 1 },
    "start": { "type": "string", "format": "date-time" },
    "end": { "type": "string", "format": "date-time" },
    "timezone": { "type": "string" },
    "location": { "type": "string" },
    "description": { "type": "string" },
    "tags": {
      "type": "array",
      "items": { "type": "string" }
    },
    "reminders": {
      "type": ["array", "null"],
      "items": {
        "type": "object",
        "required": ["minutes_before"],
        "properties": {
          "minutes_before": { "type": "integer", "minimum": 0 },
          "description": { "type": "string" },
          "action": { "type": "string", "enum": ["DISPLAY"] }
        },
        "additionalProperties": false
      }
    }
  },
  "additionalProperties": false
}
